place_id,name,rating,type,htm,latitude,longitude,description
205,Dewi Kano Tourism Village Kaligono,4.4,Agrowisata,5000,-77.348.214,1.100.803.636,desa wisata yang berfokus pada konservasi alam kegiatan pertanian dan edukasi lingkungan dengan pemandangan pegunungan
206,ARTJOG MMXIX,4.7,Budaya Dan Sejarah,50000,-77.996.687,1.103.533.668,pameran seni kontemporer berskala internasional yang diadakan tahunan di yogyakarta tahun mengusung tema keberagaman dan inklusivitas
207,Kedung Tolok,4.3,Wisata Air,0,-79.632.346,1.103.838.152,kolam alami yang terbentuk dari aliran sungai cocok untuk bermain air dan bersantai di suasana alami yang masih asri
208,Gua Jepang,4.1,Alam,10000,-75.879.932,1.104.305.322,gua peninggalan tentara jepang di masa perang dunia ii yang kini menjadi wisata sejarah sekaligus spot hiking di area kaliurang
209,Desa Wisata Wanurejo,4.4,Agrowisata,15000,-76.117.993,1.102.179.225,terletak dekat candi borobudur desa ini menawarkan aktivitas seperti membatik membuat gerabah dan belajar seni tari tradisional
210,Cane Gardens Gendhu,4.4,Alam,0,-77.435.927,1.101.478.405,kebun bunga yang menawarkan berbagai varietas tanaman hias cocok untuk wisata edukasi pertanian dan swafoto
211,Candi Donotirto,4.4,Budaya Dan Sejarah,0,-77.955.613,1.103.612.095,candi kecil yang berada di dekat mata air suci menarik untuk dikunjungi karena menyatukan unsur arsitektur keagamaan dan alam
212,Candi Lumbung,4.4,Budaya Dan Sejarah,40000,-77.481.336,110.492.962,candi budha yang terletak di kompleks prambanan memiliki struktur menyerupai lumbung padi dan menjadi bagian dari jejak akulturasi budaya hindu budha
213,Pantai Somandeng,4.5,Pantai,15000,-81.490.954,1.106.101.161,pantai di gunungkidul yang tenang dan cocok untuk piknik keluarga memiliki garis pantai yang tidak terlalu ramai dengan pasir putih bersih
214,Series Mahogany Village Nampurejo,4.4,Agrowisata,0,-786.489,1.099.833.922,kompleks wisata alam dan edukasi di tengah hutan mahoni menawarkan ketenangan homestay dan kegiatan outdoor ramah lingkungan
215,Pantai Nampu,4.6,Pantai,10000,-81.837.872,1.107.073.455,pantai alami dengan pasir putih dan ombak yang tenang ideal untuk relaksasi bermain air dan fotografi alam
216,Candi Indah,4.2,Budaya Dan Sejarah,0,-77.447.651,1.104.171.248,situs candi kecil yang masih dalam tahap konservasi namun memiliki nilai sejarah dan arkeologi penting di kawasan prambanan
217,Taman Tino Sidin,4.7,Budaya Dan Sejarah,10000,-77.995.125,1.103.449.674,taman dan galeri seni yang didedikasikan untuk pelukis sekaligus tokoh pendidikan seni rupa tino sidin cocok untuk wisata seni keluarga
218,Stasiun Kereta Api Bantul,4.4,Kuliner,0,-7.887.327,110.329.554,bangunan stasiun tua yang kini tidak beroperasi namun menjadi titik historis transportasi dan jalur rel di wilayah bantul
219,Gardu Pandang Mangol Kencana,4.2,Alam,3000,-78.378.573,1.104.890.534,spot gardu pandang yang terletak di perbukitan kulon progo menawarkan panorama matahari terbit dan cocok untuk kegiatan alam terbuka
220,Wisata Candi Kembar,4.5,Budaya Dan Sejarah,10000,-77.401.262,11.050.544,dua candi kecil berdampingan yang menawarkan suasana tenang dan nilai sejarah tinggi terletak di sekitar area pegunungan
221,Pantai Pasir Puncu,4,Pantai,10000,-78.540.573,1.099.130.624,pantai eksotis yang masih belum banyak diketahui wisatawan dengan pasir bersih dan tebing tebing batu yang unik
222,Randu Ijo,4.2,Alam,15000,-75.657.834,1.103.686.916,area wisata dengan konsep agroforestry yang menampilkan pohon randu dan edukasi lingkungan hidup
223,Bahasa Kopi,4.6,Kuliner,0,-77.344.993,1.103.897.969,kafe edukatif yang menggabungkan pengalaman ngopi dengan pelatihan bahasa diskusi budaya dan ruang komunitas kreatif
224,Cemeti - Institute for Art and Society,4.6,Budaya Dan Sejarah,0,-78.177.918,1.103.623.492,lembaga seni kontemporer di yogyakarta yang aktif mengadakan pameran diskusi dan kolaborasi seni lintas disiplin dan budaya
225,Restoe Boemi Kreo,4.5,Alam,0,-7.723.671.547,110.231.514,restoe boemi kreo sebuah rumah makan hasil karya nextdestinxction untuk masyarakat kreo
226,Tourism Village Kinahrejo,4.4,Agrowisata,0,-75.816.346,1.104.434.317,desa wisata kinahrejo terletak di lereng gunung merapi dan menjadi titik awal favorit bagi wisatawan yang ingin menjelajahi merapi melalui lava tour dikenal sebagai rumah almarhum mbah maridjan juru kunci merapi desa ini menyuguhkan pengalaman edukatif dan emosional tentang letusan merapi budaya jawa dan kehidupan masyarakat sekitar gunung berapi
227,TWM ( Tebing Watu Mabur ),4.4,Alam,2000,-79.456.084,1.104.406.992,tebing watu mabur adalah destinasi wisata alam yang berada di bantul menawarkan panorama alam luar biasa dari ketinggian spot ini populer untuk berkemah dan menyaksikan matahari terbit dengan latar perbukitan hijau serta kabut pagi yang memesona nama watu mabur berarti batu terbang mengacu pada formasi batuan unik di tebing ini
228,Tempat Wisata Mangir,4.4,Agrowisata,10000,-79.001.751,1.102.752.732,tempat wisata mangir merupakan destinasi bernuansa sejarah dan budaya yang terletak di wilayah pajangan bantul tempat ini menyimpan kisah legenda ki ageng mangir dan memiliki potensi wisata budaya pertanian serta alam pedesaan yang masih alami cocok untuk wisata edukasi dan napak tilas sejarah lokal
229,Gabugan Tourism Village,4.4,Agrowisata,0,-76.609.669,1.103.797.272,desa wisata gabugan di sleman menawarkan pengalaman pedesaan otentik dengan suasana asri dan aktivitas pertanian tradisional wisatawan dapat ikut serta dalam panen padi belajar membatik membuat kerajinan serta menikmati pertunjukan seni rakyat desa ini juga mendukung prinsip wisata ramah lingkungan dan pemberdayaan masyarakat
230,Pangurakan Gate,4.6,Budaya Dan Sejarah,15000,-78.015.969,1.103.646.114,pangurakan gate adalah pintu gerbang bersejarah yang menjadi akses utama menuju kompleks keraton yogyakarta dari arah utara bangunan ini memiliki nilai arsitektural dan historis tinggi karena menjadi bagian dari sumbu filosofis yogyakarta yang menghubungkan gunung merapi keraton dan laut selatan lokasi ini sering dilewati dalam upacara tradisional keraton dan merupakan spot foto ikonik bagi wisatawan
231,Candi Ijo,4.7,Budaya Dan Sejarah,10000,-7.783.381.475,1.105.104.366,candi ijo adalah sebuah kompleks percandian bercorak hindu berada kilometer arah tenggara dari candi ratu boko atau kira kira kilometer di sebelah timur kota yogyakarta candi ini diperkirakan dibangun antara kurun abad ke sampai dengan ke masehi pada saat zaman kerajaan medang periode mataram
232,Wanagama 1000 Selfie (WG1000S),4.5,Alam,5000,-78.928.168,1.105.472.087,hutan pendidikan wanagama dengan spot foto kekinian yang instagramable di tengah alam hijau
233,Hutan Cemara Sembung,4.2,Alam,5000,-78.306.883,1.102.897.089,hutan dengan deretan pohon cemara tinggi cocok untuk bersantai dan berfoto estetik
234,Pakem Sari Water Park,3.7,Wisata Air,20000,-7.661.928,110.413.932,wahana air keluarga dengan berbagai permainan dan kolam untuk anak hingga dewasa
235,Dodogan Cultural Tourism,4.2,Wisata Air,4000,-7.926.687,1.104.825.668,wisata budaya lokal dengan pertunjukan seni tradisional dan kuliner khas desa
236,Goa Kalisuci,4.6,Alam,2000,-8.002.397.389,1.106.395.038,destinasi cave tubing populer menyusuri sungai bawah tanah dengan ban di tengah keindahan gua alami
237,Tourism Village Mina Padi Cibuk Kidul,4.2,Agrowisata,0,-77.555.134,1.103.099.247,desa wisata pertanian berbasis mina padi ikan dan padi edukatif dan ramah lingkungan
238,Ecotourism Jatisari Seropan 3,4.3,Alam,2000,-79.436.686,1.104.440.412,wisata alam berbasis konservasi dan pertanian cocok untuk edukasi dan relaksasi
239,Eco Park Sriharjo,4.5,Alam,50000,-79.449.846,1.104.175.478,taman alam di perbukitan sriharjo dengan suasana asri dan pemandangan lembah menawan
240,Goa Sentono,4.1,Alam,5000,-78.129.534,1.104.715.037,gua kecil yang diyakini memiliki nilai spiritual dikelilingi suasana alam yang tenang
241,Desa Wisata Sendari,4.3,Agrowisata,25000,-77.375.229,110.325.111,desa kreatif pengrajin gerabah dan batik cocok untuk wisata budaya dan workshop kerajinan
242,Terasiring Sriharjo,4.6,Alam,10000,-79.448.403,1.104.180.764,persawahan bertingkat yang indah dan hijau mirip lanskap ubud bali
243,Candi Gana,4.1,Budaya Dan Sejarah,7500,-77.439.064,1.104.961.559,candi kecil bercorak hindu yang menyimpan nilai sejarah dan keunikan arsitektur
244,Kampoeng Cyber Yogyakarta,4.4,Pendidikan,0,-7.809.384,1.103.585.784,kampung modern dengan digitalisasi berbasis warga pionir smart village di jogja
245,Desa Wisata Pengkok,4.3,Agrowisata,3000,-78.729.739,1.104.957.781,desa wisata edukatif yang menyajikan kehidupan pedesaan pertanian dan budaya lokal
246,Bangsal Magangan,4.7,Budaya Dan Sejarah,10000,-78.087.595,1.103.637.221,bangunan bersejarah yang dahulu menjadi bagian penting dalam struktur keraton yogyakarta
247,Watu Tekek,4.1,Alam,10000,-76.643.486,1.102.081.121,batu besar unik yang menjadi ikon lokal berada di area wisata alam dengan suasana hening
248,Jetis Monument,4.2,Buatan,15000,-78.273.402,1.103.253.528,tugu bersejarah yang memperingati perjuangan masyarakat jetis di masa penjajahan
249,Tourism Village Display,4.3,Agrowisata,5000,-771.528,1.103.655.598,galeri mini yang menampilkan ragam desa wisata di jogja sebagai inspirasi destinasi
250,Jipangan Tourism Village,4.4,Wisata Air,4000,-78.548.212,1.103.277.628,desa wisata yang menawarkan budaya pertanian dan atraksi kesenian lokal
251,Pantai Bukit Indah Nampu,4.4,Pantai,10000,-81.840.158,1.107.081.369,pantai dengan bukit kecil dan pemandangan laut yang eksotis cocok untuk sunset hunting
252,Candi Siwa,4.5,Budaya Dan Sejarah,25000,-77.520.327,1.104.912.079,salah satu candi utama di kompleks prambanan megah dan penuh nilai spiritual hindu
253,Geger Menjangan,4.1,Alam,5000,-76.993.041,1.100.306.903,bukit karst dengan pemandangan luas dan cerita legenda tentang kijang suci
254,Pantai Segoro Kidul,4.3,Pantai,50000,-7.996.434,1.102.414.412,pantai penuh legenda yang diyakini sebagai gerbang laut selatan menyajikan panorama mistis nan indah
255,Museum dan Tanah Liat,4.6,Budaya Dan Sejarah,0,-78.200.451,1.103.394.857,museum kreatif berbasis tanah liat dengan karya seni interaktif dan edukasi keramik
256,Tugu Jam,4.5,Budaya Dan Sejarah,24000,-78.064.821,1.103.630.733,penanda waktu klasik di area kota yang menjadi ikon lokal dengan nilai sejarah unik
257,Pantai Ngrawah,4.5,Pantai,10000,-81.250.824,1.105.202.032,pantai tersembunyi dengan pasir putih dan ombak tenang cocok untuk camping atau eksplorasi
258,Tourism Village Mlangi,4.7,Agrowisata,5000,-77.622.125,1.103.313.254,desa religius yang terkenal dengan pondok pesantren cocok untuk wisata religi dan budaya
259,Between Two Gates,4.6,Agrowisata,0,-78.309.782,1.103.992.208,spot foto di antara dua gapura klasik simbol transisi budaya dan waktu di yogyakarta
260,"Nanggulan Rice Terrace, Watumurah, Pendowoharjo",4.3,Alam,5000,-77.479.509,1.101.903.153,hamparan sawah bertingkat yang memesona di kawasan pedesaan nanggulan
261,Museum Sonobudoyo Unit II,4.7,Budaya Dan Sejarah,10000,-78.040.124,110.366.348,unit lanjutan museum budaya jawa menyajikan koleksi keris batik dan artefak sejarah
262,Sonobudoyo State Museum Unit II,4.7,Budaya Dan Sejarah,10000,-78.040.124,110.366.348,museum negara yang memamerkan kekayaan budaya dan sejarah jawa secara mendalam
263,Brahma Temple,4.5,Budaya Dan Sejarah,25000,-77.523.837,1.104.912.216,candi di kompleks prambanan yang didedikasikan untuk dewa brahma arsitekturnya megah dan simetris
264,Tradisional Park,4.3,Buatan,20000,-76.286.063,1.104.252.096,taman dengan nuansa tradisional yang menampilkan budaya dan kehidupan desa zaman dulu
265,Air Terjun Banyu Nibo,4.3,Wisata Air,0,-79.033.828,1.104.572.075,air terjun mungil yang dikelilingi pepohonan cocok untuk healing dan eksplorasi
266,Obelix Hills Sunset View,4.6,Buatan,25000,-78.070.316,1.105.215.714,spot kekinian untuk menikmati sunset dengan café outdoor dan banyak spot foto
267,Goa Jepang Pengklik,4.4,Alam,10000,-78.037.677,1.104.779.306,gua buatan peninggalan jepang saat perang dunia ii kini jadi situs sejarah dan wisata edukasi
268,Pantai Ngluwen,4.5,Pantai,10000,-81.140.054,1.104.898.614,pantai perawan yang tenang cocok untuk pelarian dari keramaian kota
269,Desa Wisata Malangan,4.4,Agrowisata,5000,-77.586.856,1.102.533.026,desa wisata dengan aktivitas budaya seperti seni karawitan dan kuliner tradisional
270,pantai Trisik,3.9,Pantai,3000,-79.673.349,110.182.607,pantai alami dengan konservasi penyu dan suasana pantai yang bersih dan sejuk
271,Karangnongko Temple,4.1,Budaya Dan Sejarah,0,-76.771.502,1.105.569.914,situs candi kecil bercorak hindu tersembunyi namun menyimpan pesona historis
272,Watu Kendhil,4.3,Alam,5000,-76.353.212,1.102.147.341,batu besar unik yang menjadi simbol lokal dan kerap dikunjungi untuk meditasi alam
273,Gazebo Fakultas Pertanian UGM,4.5,Buatan,0,-77.682.109,1.103.813.503,ruang terbuka hijau untuk diskusi belajar atau bersantai di lingkungan kampus
274,Dewi Rawe,4.5,Buatan,10000,-77.514.803,1.103.352.759,destinasi wisata berbasis pertanian dan budaya di sleman dengan berbagai aktivitas edukatif
275,Embung KP,4.3,Wisata Air,4000,-76.588.773,110.235.082,embung atau bendungan kecil yang digunakan untuk irigasi dan kini jadi spot piknik serta mancing
276,Geopark Gunung Sewu,4.4,Buatan,5000,-78.475.299,1.104.795.506,kawasan konservasi alam karst yang masuk unesco global geopark penuh gua dan lanskap eksotis
277,Goa Payaman,4.2,Alam,25000,-78.346.264,110.258.599,gua alami yang masih alami dan jarang dikunjungi cocok untuk petualang alam
278,Pantai Watunene,4.6,Pantai,7500,-81.594.636,1.106.292.219,pantai tersembunyi di pesisir selatan dengan hamparan pasir putih dan batuan indah
279,Desa Wisata Nawung,4.3,Wisata Air,20000,-78.202.819,1.105.425.329,desa wisata yang fokus pada pelestarian budaya dan lingkungan serta kuliner tradisional
280,Kadisoka Temple,3.8,Budaya Dan Sejarah,0,-77.553.303,1.104.459.721,candi kecil yang ditemukan di tengah pemukiman menyimpan nilai arkeologi penting
281,Kampung Wisata Tanen | KAWITAN,4.4,Agrowisata,0,-76.270.688,1.104.201.728,kampung yang memadukan pertanian seni tradisional dan ekowisata dalam satu tempat
282,MANGGALIA INDAH,3.9,Agrowisata,15000,-75.915.194,1.105.074.483,tempat wisata modern keluarga dengan fasilitas hiburan dan kuliner yang nyaman
283,Desa Wisata Batur,4.4,Alam,15000,-78.597.347,1.105.498.557,desa yang menawarkan keindahan alam dan kearifan lokal dengan aktivitas outbound dan budaya
284,Museum Rs Mata Dr Yap,4.5,Budaya Dan Sejarah,0,-7.780.141,1.103.741.398,museum kedokteran mata pertama di indonesia menyimpan sejarah dunia oftalmologi
285,Government Tourist Information Center,4.6,Agrowisata,0,-77.953.215,1.103.657.371,pusat informasi resmi pariwisata yogyakarta lengkap dengan peta dan brosur wisata
286,Museum Geoteknologi Mineral,4.5,Budaya Dan Sejarah,0,-77.816.997,1.104.146.097,museum edukatif yang menampilkan batuan mineral dan teknologi geologi
287,Unit Office Taman Wisata Candi Prambanan,4.6,Agrowisata,50000,-77.541.053,1.104.928.588,kantor pengelola resmi wisata candi pusat informasi dan tiket
288,Perwara Temple,4.4,Budaya Dan Sejarah,50000,-77.516.703,1.104.921.881,candi candi pendamping di kompleks prambanan yang berjumlah puluhan mencerminkan struktur kosmis hindu
289,Tourism Village Srowolan,4.3,Agrowisata,10000,-76.663.773,1.103.858.213,desa wisata di kaki merapi dengan kesejukan alam kopi lokal dan atraksi budaya
290,Candi Morangan,4.3,Budaya Dan Sejarah,15000,-76.848.173,1.104.694.913,situs candi yang ditemukan kembali dalam keadaan terkubur simbol sejarah masa lalu yang unik
291,Tourism Village Bokesan,4.4,Agrowisata,0,-7.706.782,1.104.742.429,desa wisata dengan pengalaman berkebun beternak dan edukasi alam
292,Lava Tour Merapi,4.8,Alam,350000,-77.531.441,1.103.473.714,wisata jeep menyusuri jalur bekas letusan merapi dengan cerita sejarah dan edukasi geologi
293,Tuk Si Bedug,4.5,Wisata Air,0,-77.343.858,1.103.004.508,sumber mata air alami yang dikeramatkan warga diyakini memiliki energi spiritual
294,Pantai Baru,4.3,Pantai,4000,-81.338.843,1.105.510.278,pantai yang mulai populer dengan angin segar dan deretan kincir angin sebagai daya tarik utama
295,WISATA DESA WATU LEDHEK,4.3,Wisata Air,0,-77.162.707,1.103.898.193,desa wisata dengan atraksi seni tari ledhek dan panorama alam khas pedesaan
296,Wisata Alam Pos Mati,4.3,Alam,0,-76.264.157,1.101.789.032,wisata yang menyajikan pemandangan menarik dari atas bukit
297,Morangan Temple,4.1,Budaya Dan Sejarah,15000,-76.848.728,1.104.695.674,candi hindu dari abad ke atau ke yang terletak di morangan sleman terletak meter di bawah permukaan tanah dan terdiri dari candi utama serta candi perwara yang terbuat dari batu andesit
298,Sekretariat Sementara Museum Anak Kolong Tangga,4.4,Agrowisata,5000,-78.187.216,1.103.646.999,museum mainan pertama di indonesia terletak di bawah tangga gedung taman budaya yogyakarta menampilkan berbagai koleksi mainan dan alat peraga edukatif
299,Taman wisata merapi garden Cangkringan,4.5,Wisata Air,10000,-758.728,110.442.803,taman rekreasi yang terletak di lereng gunung merapi menawarkan kolam renang dan taman bermain yang cocok untuk keluarga
300,Kalinampu Natural Park,4.2,Buatan,5000,-7.968.594,1.103.473.611,taman alam di bantul yang menawarkan pemandangan bunga eceng gondok dan suasana mirip jepang cocok untuk berfoto dan rekreasi keluarga
301,Brug Londho River Track,3.9,Agrowisata,0,-77.064.216,1.104.195.737,jalur wisata alam di ngaglik sleman yang menawarkan pengalaman menyusuri sungai dan pemandangan sawah yang asri
302,Monument obelisk 1 Century of Muhammadiyah,4.4,Museum,0,-78.131.132,1.103.221.465,monumen obelisk abad muhammadiyah adalah tugu peringatan di kampus umy bantul yang dibangun untuk mengenang tahun kontribusi muhammadiyah di bidang pendidikan sosial dan dakwah monumen berbentuk obelisk ini juga menjadi landmark edukatif dan simbol keteguhan organisasi
303,OMAH ELABU,4.3,Budaya Dan Sejarah,0,-78.499.751,1.104.795.727,restoran dengan konsep tradisional pedesaan di patuk gunung kidul menawarkan suasana sejuk dan nyaman dengan pemandangan perbukitan
304,Watu Loncat,4.5,Alam,0,-78.763.184,1.104.524.533,objek wisata alam di dlingo bantul yang menawarkan pemandangan batu loncat dan suasana alam yang menenangkan
305,Watu Loncat,4.5,Alam,0,-78.763.184,1.104.524.533,objek wisata alam di dlingo bantul yang menawarkan pemandangan batu loncat dan suasana alam yang menenangkan
306,Pantai Imorenggo,4.4,Pantai,0,-79.658.312,1.101.824.816,pantai dengan pasir hitam eksotis di kulon progo menawarkan keindahan alam yang masih alami dan cocok untuk bersantai
307,Sungai Oya,4.7,Wisata Air,60000,-79.539.315,1.104.246.111,sungai yang mengalir di gunung kidul menawarkan aktivitas river tubing dan pemandangan alam karst yang memukau
308,Tourism Village Pandeyan,4.6,Agrowisata,0,-7.814.481,110.386.165,desa wisata di yogyakarta yang menampilkan kekayaan budaya lokal termasuk kerajinan batik dan tembikar serta suasana pedesaan yang asri
309,Wisata Taman Kelinci Borobudur,4.8,Agrowisata,25000,-76.223.711,1.102.216.511,tempat wisata edukatif di dekat candi borobudur menawarkan interaksi dengan kelinci dan berbagai spot foto menarik
310,JOGJA TREVELING,4.9,Agrowisata,350000,-77.654.126,1.103.422.458,penyedia layanan paket wisata di yogyakarta yang menawarkan berbagai destinasi menarik dengan harga terjangkau
311,Spot Pintoe Langit Dahromo,4.6,Alam,5000,-79.121.203,1.104.365.253,spot wisata di bantul yang terkenal dengan pemandangan matahari terbenamnya dan spot foto yang instagramable
312,Mesjid  Kelompok Candi,4.6,Religi,0,-76.995.786,1.104.132.218,masjid yang berada di sleman mudah diakses dengan transportasi umum dan dekat dengan beberapa halte bus utama
313,TeknoPark Mega Andalan,4.5,Agrowisata,0,-7.803.753,1.104.830.177,kawasan industri dan edukasi di kalasan sleman yang fokus pada produksi peralatan medis serta menjadi tempat kunjungan pembelajaran teknologi manufaktur
314,Tourism Village Duchy,4.4,Agrowisata,0,-7.806.093,11.035.831,desa wisata budaya di sekitar keraton yogyakarta yang menyajikan seni kuliner dan kehidupan tradisional masyarakat jawa secara autentik
315,Sukmojoyo Hill,4.6,Alam,10000,-76.301.034,1.101.752.282,bukit di yogyakarta yang menawarkan pemandangan alam yang indah dan suasana yang tenang cocok untuk relaksasi
316,Patung Monyet Kaliurang,4.3,Buatan,10000,-75.999.674,1.104.294.736,patung ikonik di kawasan kaliurang yang menjadi salah satu daya tarik wisatawan untuk berfoto
317,KAWIDASRI,4.4,Agrowisata,0,-76.372.592,1.103.891.213,kawidasri kampoeng wisata daleman asri adalah desa wisata di lereng gunung merapi sleman yang menawarkan wisata alam dan edukatif seperti susur sungai outbound dan camping dalam suasana pedesaan yang sejuk dan asri
318,Nglangkap Beach,4.3,Pantai,10000,-81.107.366,110.479.256,pantai yang menawarkan keindahan alam dan suasana yang tenang cocok untuk bersantai dan menikmati pemandangan laut
319,Taman Wisata Candi Sojiwan,4.5,Budaya Dan Sejarah,8000,-77.604.197,1.104.955.436,kompleks candi yang menawarkan pemandangan arsitektur kuno dan suasana yang menenangkan
320,Candi Wisnu,4.5,Budaya Dan Sejarah,75000,-7.751.692,1.104.912.105,salah satu candi di kompleks prambanan yang didedikasikan untuk dewa wisnu menampilkan arsitektur khas hindu
321,Kampung Wisata Sosromenduran,4,Agrowisata,0,-779.219,110.362.151,kampung wisata yang menawarkan pengalaman budaya lokal termasuk seni kuliner dan kerajinan tangan
322,Guide Francophone et Chauffeur de Voiture Privé de Voyage Yogyakarta Java Indonésie,5,Budaya Dan Sejarah,11500,-78.206.473,1.103.773.068,layanan pemandu wisata dan sopir pribadi berbahasa prancis yang menyediakan tur khusus di yogyakarta dan sekitarnya untuk wisatawan francophone
323,Pantai Botorubuh,4.6,Pantai,5000,-82.003.473,1.107.082.335,pantai yang menawarkan keindahan alam dan suasana yang tenang cocok untuk bersantai dan menikmati pemandangan laut
324,Candi Dawangsari,4.3,Budaya Dan Sejarah,0,-77.743.486,1.104.973.873,candi yang terletak di yogyakarta menawarkan pemandangan arsitektur kuno dan suasana yang menenangkan
325,Ijo Temple Wooden Mosque,4.4,Religi,0,-77.847.528,1.105.128.442,pasoedjoedan al liwung atau yang dikenal dengan masjid candi ijod merupakan masjid yang didirikan tidak jauh dari candi ijo dimana kita ketahui candi ijo merupakan candi tertinggi di yogyakarta masjid ini berciri khas bangunan tradisional modern dengan sentuhan ornamen kayu jati masjid ini didesain sedemikian rupa sehingga pengunjung khusus nya yg ingin beribadah merasakan kenyaman alamiah dari masjid ini juga bisa dilihat pemandangan hamparan kota yogyakarta dan khususnya bandara adi sucipto bangunan masjid yg didesain terbuka menjadikan seolah beribadah menyatu dgn alam
326,Gua Permoni,4.3,Alam,0,-78.796.951,1.103.965.111,sebuah gua alami yang terkenal dengan keindahan stalaktit dan stalagmitnya menawarkan pengalaman jelajah alam yang menantang
327,Kampung Wisata Rejowinangun,4.3,Agrowisata,0,-78.152.776,1.103.988.359,sebuah desa wisata yang menawarkan pengalaman budaya lokal termasuk kegiatan pertanian dan kerajinan tangan tradisional
328,Tawangrejo Agro Tourism,4.4,Agrowisata,30000,-76.354.887,1.104.032.545,destinasi wisata agrowisata yang menyajikan keindahan alam serta pengalaman memetik buah langsung dari kebun
329,Bukit Gunung Kidul Pantai Indrayanti,4.7,Pantai,10000,-81.501.214,1.106.121.077,bukit dengan pemandangan spektakuler yang menghadap ke pantai indrayanti terkenal dengan pasir putih dan ombak yang tenang
330,Pemancingan Sungkono,3.6,Wisata Air,0,-79.436.745,1.102.288.385,tempat wisata pemancingan yang cocok bagi para penggemar memancing dilengkapi dengan fasilitas yang nyaman
331,Gantangan Lomba Burung New POSJAKAL,4.7,Agrowisata,0,-77.459.912,1.103.916.566,arena lomba burung berkicau yang menjadi ajang kompetisi bagi pecinta burung
332,Kids Fun - Blaster Boat,4.2,Buatan,20000,-78.285.087,1.104.400.289,tempat hiburan keluarga dengan permainan perahu berbasis air yang seru dan aman untuk anak anak
333,Kids Fun - Arung Jeram,4.4,Buatan,25000,-78.285.622,1.104.412.651,aktivitas arung jeram yang menyenangkan dan penuh tantangan cocok untuk anak anak dan keluarga
334,THR Gabusan Square,3.8,Budaya Dan Sejarah,0,-78.773.087,1.103.520.114,pusat perbelanjaan yang juga dilengkapi dengan fasilitas hiburan seperti bioskop dan area permainan anak
335,Gedung Jefferson,4.2,Budaya Dan Sejarah,0,-77.832.145,1.103.658.164,sebuah gedung ikonik yang menjadi salah satu landmark kota menawarkan fasilitas ruang acara dan pusat pertemuan
336,Taman Lampion Candi Plaosan,4.4,Budaya Dan Sejarah,5000,-77.402.939,1.105.053.448,taman indah yang dipenuhi lampion warna warni menciptakan suasana yang romantis dan cocok untuk berfoto
337,Grojogan Pucung,4.5,Wisata Air,0,-7.990.371,1.103.421.397,air terjun alami yang menawarkan kesegaran dengan suasana alam yang asri dan menenangkan
338,Gallery Amri Yahya,4.9,Religi,75000,-77.992.289,1.103.537.936,galeri seni yang memamerkan karya seni kontemporer memberikan wawasan mendalam mengenai seni lokal
339,Pantai Daud,4.4,Pantai,0,-8.157.724,1.106.246.487,pantai yang relatif sepi menawarkan keindahan alam dengan pasir hitam dan ombak yang cocok untuk bersantai
340,Pantai Parangracuk,4.5,Pantai,0,-81.316.897,1.105.447.417,pantai dengan pemandangan indah dan ombak yang besar cocok untuk kegiatan surfing dan menikmati alam
341,Pantai Sundak Timur,4.4,Pantai,0,-8.147.072,1.106.079.043,pantai yang terkenal dengan pasir putihnya yang bersih dan suasana tenang ideal untuk berlibur dan bersantai
