place_id,name,rating,type,htm,latitude,longitude,description
41,Taman Wisata Kaliurang,4.4,Alam,8000,-7.598.797,11.042.636,taman wisata kaliurang dapat menjadi referensi wisata akhir pekan keluarga pemandangan sekitar sangatlah indah masih banyak pepohonan yang tumbuh tinggi menjulang ditambah lagi pemandangan puncak gunung merapi yang gagah selain itu udara di sekitar pun masih sangat sejuk aroma asap kendaraan bermotor pun tidak tercium di kawasan ini berada di sini membuat paru – paru menjadi lebih sehat banyak wisatawan yang datang bersama keluarga duduk santai beralaskan tikar di atas rerumputan sambil bercengkerama dengan keluarga ditambah lagi suasana yang sangat mendukung untuk beramah – tamah selain menyuguhkan pemandangan yang indah taman wisata kaliurang pun memiliki wahana outbound seperti flying fox hingga rumah pohon ridz high rope
42,Jogja National Museum,4.6,Museum,0,-78.001.175,1.103.534.164,bagi para pecinta kesenian tentu tidak akan pernah melewatkan yang namanya tempat atau gedung yang menyimpan berbagai hasil kesenian salah satu gedung kesenian di kawasan yogyakarta yang cukup terkenal adalah jogja national museum letaknya berada di jalan amri yahya yogyakarta ini museum ini sendiri sudah berdiri cukup lama dan menyajikan berbagai karya seni menarik nanapik secara singkat museum ini mempertontonkan aneka karya seni kontemporer yang unik dan berkualitas tinggi bagi anda yang sangat suka atau sedang menempuh studi seputar karya seni kontemporer maka keputusan untuk berkunjung ke tempat ini sangatlah tepat anda akan disambut dengan karya karya seni rupa dari berbagai seniman dan juga dengan kreativitas serta keunikannya masing masing
43,Taman Pintar Yogyakarta,4.5,Buatan,20000,-7.799.757.357,1.103.678.697,taman pintar yogyakarta adalah wahana wisata yang terdapat di pusat kota yogyakarta tepatnya di jalan panembahan senopati no yogyakarta di kawasan benteng vredeburg taman ini memadukan tempat wisata rekreasi maupun edukasi dalam satu lokasi tempat rekreasi ini sangat baik untuk anak anak dalam masa perkembangan taman ini khususnya pada wahana pendidikan anak usia dini dilengkapi dengan teknologi interaktif digital serta pemetaan video yang akan memacu imajinasi anak serta ketertarikan mereka terhadap teknologi
44,Pantai Indrayanti,4.4,Pantai,12000,-81.508.415,1.106.129.852,pantai kecil berpasir putih yang dikelilingi pepohonan dan bebatuan besar serta beragam restoran pertokoan
45,Mangrove Jembatan Api-Api (MJAA),4.3,Alam,8000,-789.485,1.100.253.631,mangrove jembatan api api di kulon progo ini memadukan konsep alam dan spot instagenik anda bisa bersantai sambil foto foto di sini
46,Embung Nglanggeran,4.5,Buatan,10000,-78.471.399,1.105.468.589,embung nglanggeran merupakan waduk kecil tempat menampung air yang memiliki luas sekitar hektar air embung ini digunakan untuk sarana pengairan di area perkebunan sekitar selain untuk pengairan telaga ini juga dimanfaatkan sebagai obyek wisata itu karena keindahan panorama yang dapat disaksikan dari embung berketinggian sekitar meter di atas permukaan laut ini selain embung telaga tampungan air pemandangan gunung api purba menjadi pesona yang ditawarkan oleh objek wisata tersebut
47,Bukit Wisata Pulepayung,4.5,Alam,10000,-78.001.106,1.101.238.954,pule payung kulon progo yogyakarta merupakan wisata alam dengan spot foto instagramable letaknya tidak jauh dari kalibiru yaitu terletak di kulon progo yogyakarta tempat wisata yang satu ini sangat direkomendasi untuk anak muda yang ingin mendapatkan foto foto unik karena memiliki banyak spot foto menarik daya tarik yang pertama dari pule payung yogyakarta adalah objek wisata yang menyajikan pesona alam pegunungan sehingga orang orang menyebutnya dengan bukit wisata pule payung yogyakarta adalah objek wisata yang bukan hanya sekedar menawarkan keindahan serta kenyamanan dalam berwisatanya saja namun mampu memberikan rasa aman bagi setiap pengunjungnya daya tarik pule payung yogyakarta yang paling populer adalah onjek wisata yang menyajikan beragam spot keren yang instagramable
48,Seribu Batu Songgo Langit,4.6,Alam,2500,-7.931.099,110.429.738,disekitar hutan pinus ternyata masih banyak tempat wisata yang wajib dikunjungi salah satunya adalah seribu batu songgo langit namanya terdengar asing namun apabila disebut rumah hobbit tentunya sahabat akan segera tahu tempat wisata ini ya seribu batu songgo langit adalah lokasi dimana terdapat rumah hobbit yang ada di kawasan mangunan rumah hobbit yang dimaksud berbeda dengan yang ada di new zealand pastinya rumah hobbit disini merupakan tiruan dari yang terdapat di film hobbit atau yang ada di new zealand songgo langit berarti penyangga langit hal ini dikarenakan di seribu baru songgo langit terdapat bukit yang seakan akan merupakan tiang dari langit seribu batu songgo langit merupakan tempat wisata di kawasan dlingo yang menawarkan berbagai macam atraksi wisata namun kebanyakan adalah spot foto spot foto di seribu batu hampir semuanya anti mainstream
49,Jurang Tembelan Kanigoro,4.5,Alam,0,-79.401.065,1.104.300.062,objek wisata bantul ini ialah wisata alam spot foto terbaru yang sekarang menjadi hits di kalangan remaja kekinian sebab jurang tembelan mangunan jogja memiliki deck view atau gardu pandangan terlihat cukup unik mirip seperti kapal tak heran pada akhirnya banyak wisatawan menyebutnya sebagai kapal titanic diatas awan sebelum seperti sekarang sebenarnya jurang tembelan kanigoro bantul tergolong masih sepi pengunjung lantaran baru saja dikembangkan oleh pihak pengelola wisata namun spot foto corner berupa gardu pandangan unik dan keindahan dimilikinya membuat pengunjung mulai ramai menyemarakkan sehingga tak lagi wisatawan lokal saja berbondong bondong kesana wisatawan luar kota pun dibuat penasaran dan menyempatkan waktu berswafoto di wisata alam jogja ini pengunjung diperbolehkan bebas melakukan sesi pemotretan atau pun hanya sekedar berselfie ria tak hanya itu saja pengunjung pun juga dapat menyaksikan lanskap matahari terbenam ketika menjelang sore hari dan juga kala matahari terbit yang diiringi pula keindahan tebal nya kabut putih khas pegunungan mangunan
50,Malioboro,4.7,Buatan,3000,-77.982.487,1.103.652.793,malioboro adalah jantung kota jogja meskipun terkenal sebagai surga belanja cendera mata dan barang kerajinan ternyata tak sedikit wisatawan dan orang lokal mendatangi malioboro pagi pagi sekali untuk berolahraga atau sekedar menikmati udara segar sambil mencari sarapan
51,Blue Lagoon Jogja,4.3,Alam,3000,-77.044.358,11.045.026,blue lagoon jogja merupakan salah satu obyek wisata yang di jadikan tempat pemandian sumber mata air ini yang muncul dari permukaan tanah di dalam kolam apabila anda melihat ke dalam kolam akan terlihat gelembung gelembung kecil yang muncul dari permukaan tanah hal itu menunjukkan bahwa terdapat air yang terus menerus muncul dari permukaan tanah tersebut meskipun blue lagoon di jogja ini sudah lama namun tempat wisata ini mulai tenar dipertengahan tahun pemandian blue lagoon ini terletak di desa dalem widodomartani ngemplak sleman yogyakarta
52,Bundaran UGM,4.7,Buatan,0,-77.760.052,1.103.760.616,bundaran ugm merupakan gerbang masuk utama universitas gadjah mada
53,Pantai Pok Tunggal,4.5,Pantai,10000,-81.554.468,1.106.217.582,pantai pok tunggal adalah salah satu pantai populer di gunungkidul pantai ini terletak di desa tepus kecamatan tepus posisinya sejajar dan tak jauh dari pantai indrayanti dan pantai watulawang yang tak kalah populer nama pok tunggal berasal dari keberadaan pohon duras di kawasan pantai tersebut pohon jenis ini dikenal sangat sulit tumbuh di daerah pesisir karena hanya satu satunya pohon ini kemudian menjadi semacam maskot bagi pantai ini yang menjadi ciri khas pantai ini adalah bentuknya yang sempit dan memanjang di samping itu lokasinya yang dikelilingi bukit kapur dan karang menjadikan pok tunggal tampak lebih eksotis pantai ini cocok sebagai destinasi berbagai macam kegiatan rekreasi
54,Pantai Ngobaran,4.5,Pantai,5000,-81.191.333,1.105.050.409,keunikan yang menjadi ciri khas pantai ngobaran adalah adanya pura dan arca keberadaannya membuat sekilas pantai ngobaran memiliki suasana khas yang mirip dengan pulau bali satu keunikan yang kemungkinan besar tersembunyi dari kebanyakan wisatawan adalah adanya sumber air tawar di tepi laut namun aliran air tawar hanya bisa ditemukan ketika air laut sedang surut satu sajian spesial yang bisa didapatkan di pantai ngobaran adalah landak laut atau bulu babi kuliner ini bisa dipesan di warung warung yang ada di sekitar pantai bagian landak laut yang dimakan adalah dagingnya
55,Bukit Panguk Kediwung,4.5,Alam,3000,-79.583.695,1.104.407.622,bukit panguk kediwung berlokasi di kediwung mangunan dlingo bantul yogyakarta jangan khawatir untuk tersesat karena di sepanjang jalan menuju ke lokasi kita akan melihat beberapa papan petunjuk kurang lebih berjarak km dari pusat kota yogyakarta dari pusat kota yogyakarta anda bisa bergerak menuju ke selatan tepatnya ke arah jalan imogiri timur ikuti jalan hingga menemukan pasar imogiri lalu belok kiri dan lanjutkan perjalanan menuju ke arah dlingo dari sana anda akan mulai melihat petunjuk jalan menuju bukit panguk kediwung akses jalan menuju bukit panguk kediwung sudah diaspal halus hanya saja konturnya sedikit naik turun namun masih dalam kategori aman sangat disarankan untuk menggunakan kendaraan pribadi karena akses ke sini menggunakan kendaraan umum cukup sulit salah satu yang menjadi magnet bagi pengunjung untuk datang adalah keindahan pemandangan alamnya pengelola sudah menyediakan beberapa gardu pandang terbuat dari kayu dan bambu yang sengaja dibangun menjorok ke arah bibir tebing sehingga pengunjung bisa melihat dengan jelas pemandangan di bawah bukit panguk kediwung yang eksotis dari atas kita bisa melihat aliran panjang sungai oya yang membelah bukita hijau yang menghampar hijau gardu pandang ini bukan gardu pandang biasa karena memiliki bentuk bentuk yang unik karena sekaligus jadi spot foto ada yang berbentuk jembatan memanjang bentuk sayap kupu kupu bentuk kereta kuda dan masih banyak lagi gardu pandang dengan bentuk biasa juga tersedia gardu pandang di puncak bukit penguk kediwung ini terbagi dalam dua bagian yaitu bagian timur dan selatan gardu pandang bagian timur sangat cocok untuk menikmati matahari terbit di pagi hari sedangkan gardu pandang sebelah selatan menghadap ke pegunungan yang berjajar kedua spot sama sama menyuguhkan pemandangan yang luar biasa dan tidak boleh anda lewatkan ketika liburan di yogyakarta
56,Kebun Teh Nglinggo,4.5,Agrowisata,10000,-7.647.054,1.101.414.699,wisata kebun teh nglinggo adalah satu satunya kebun teh yang berada di yogyakarta sebenarnya kebun teh ini merupakan tempat mata pencaharian penduduk di sekitar pagerhajo kemudian warga mempunyai ide untuk menjadikannya sebagai tempat wisata dengan pesona alamnya kebun teh nglinggo menjadi objek wisata yang cukup terkenal di kulon progo
57,Pantai Nglambor,4.4,Pantai,10000,-81.827.028,1.106.792.399,pantai nglambor adalah sebuah pantai eksotis yang terletak di kelurahan purwodadi kecamatan tepus gunung kidul daerah istimewa yogyakarta lokasinya persis di sebelah barat dari pantai siung dan sebelah timur dari pantai jogan jaraknya kurang lebih km dari pusat kota jogja pantai ini menawarkan panorama pantai yang indah
58,Air Terjun Kedung Pedut,4.5,Alam,3000,-77.699.875,1.101.210.707,air terjun kedung pedut atau biasa disebut curug kedung pedut berasal dari istilah bahasa jawa curug yang berarti air terjun kedung berarti kubangan atau kolam dan pedut berarti kabut air terjun kedung pedut merupakan salah satu wisata alam yang di kulonprogo yang dikenal karena keindahan warna airnya
59,Pantai Ngandong,4.5,Pantai,10000,-8.146.423,1.106.061.408,pantai ini memiliki garis pantai yang panjang dengan pasir putih yang bersih dan lembut ada bebatuan di pinggir pantai yang bisa dimanfaatkan oleh pengunjung untuk bermain air permainan air disini selain berenang juga tersedia fasilitas kano pemandangan unik yang dapat dilihat di pantai ini adalah adanya pulau yang berada di tengah laut saat sedang surut pulau itu bisa dicapai dengan jalan kaki
60,Pantai Sepanjang,4.4,Pantai,10000,-81.366.656,1.105.659.962,siapa sangka ternyata yogyakarta pun punya “kuta” nya sendiri ialah pantai sepanjang salah satu pantai di kabuaten gunungkidul daerah yang satu ini memang memiliki koleksi pantai cantik yang tak terhitung jumlahnya bahkan pantai ini digadang gadang sebagai ‘kuta tempo doeloe‘
61,Candi Sewu,4.6,Budaya Dan Sejarah,10000,-77.439.217,1.104.929.095,candi sewu adalah candi buddha yang dibangun pada abad ke masehi yang berjarak hanya delapan ratus meter di sebelah utara candi prambanan candi sewu merupakan kompleks candi buddha terbesar kedua setelah candi borobudur di jawa tengah candi sewu berusia lebih tua daripada candi borobudur dan prambanan meskipun aslinya memiliki candi oleh masyarakat setempat candi ini dinamakan sewu yang berarti seribu dalam bahasa jawa penamaan ini berdasarkan kisah legenda loro jonggrang
62,Gunung Api Purba Nglanggeran,4.6,Alam,15000,-78.427.585,1.105.379.165,kawasan ekosistem gunung purba nglanggeran atau yang biasa disebut gunung nglanggeran ini merupakan kawasan yang litologinya disusun oleh material vulkanik tua berbentuk gunung batu raksasa yang membentang sepanjang kurang lebih meter dengan tinggi mencapai meter di kawasan gunung api purba nglanggeran juga dijumpai fauna dan flora langka seperti tanaman tremas tanaman obat yang hanya hidup dikawasan ekowisata gunung api purba kera ekor panjang
63,Galaxy Waterpark,4.3,Wisata Air,35000,-78.159.633,1.104.136.917,galaxy waterpark cocok sebagai opsi untuk berlibur bersama keluarga apalagi untuk anak anak disini disediakan bermacam wahana seperti kolam arus flying fox wahana water slide kolam olimpic yang didesain dengan standar internasional untuk para atlet dewasa renang
64,Pemecah Ombak Pantai Glagah,4.4,Buatan,5000,-79.190.028,1.100.775.951,pemecah gelombang merupakan atraksi wisata utama yang ada di pantai glagah banyak pengunjung datang ke pantai ini untuk melihat secara langsung seperti apa pemecah gelombang itu ada dua pemecah gelombang di kawasan pantai glagah ini pemecah gelombang yang banyak dikunjungi wisatawan ada di sisi barat yang satu bagian dengan kawasan pantai pasir glagah pemecah gelombang sisi timur bisa dijangkau melalui dermaga adikarta
65,Pantai Timang,4.5,Pantai,5000,-81.759.266,1.106.624.196,begitu memasuki wilayah pantai pengunjung akan disambut dengan indahnya perpaduan warna alam air di bibir pantai yang berwarna hijau toska dan semakin berwarna biru ke tengah laut tidak perlu ditanya lagi tentu airnya begitu jernih dan bersih selain itu terdapat pula perbukitan yang ditumbuhi banyak pohon begitu menyejukkan dipandang mata batu – batu karang yang besar membentang dengan gagahnya siap menghadang besarnya ombak yang menghantam pantai yang paling khas dari pantai ini adalah keberadaan gondola untuk menyeberang menuju pulau timang gondola ini membentang dari pantai menuju ke pulau timang yang berupa batu karang gondola ini terbuat dari kayu sederhana dengan tali tambang yang ditarik manual wahana lain yang juga memacu adrenalin adalah jembatan gantung jembatan ini juga menghubungkan area pinggir pantai dengan pulau timang dimana jembatan ini menjadi alternatif bagi pengunjung yang ingin menyeberang selain menggunakan gondola
66,Museum HM Soeharto,4.4,Museum,0,-77.913.177,1.102.805.284,museum soeharto adalah adalah bangunan berbudaya dan sejarah berbentuk museum yang menyimpan memoar dan peninggalan peninggalan jenderal besar tni soeharto yang diresmikan pada tahun museum ini berdiri di atas tanah milik soeharto yang terletak di dusun kemusuk lor desa argomulyo kecamatan sedayu kabupaten bantul daerah istimewa yogyakarta di dalam memorial ini terdapat sebuah bangunan joglo besar di pusat lokasi rumah kakek buyut pak harto yaitu notosudiro terdapat juga barang barang peninggalan diorama budaya dan sejarah kehidupan pak harto dokumen arsip nasional video dan beberapa foto yang berkaitan dengan budaya dan sejarah pak harto
67,Bukit Lintang Sewu,4.5,Alam,3000,-79.157.997,1.104.366.436,bukit lintang sewu merupakan salah satu tempat wisata alam yang berhawa sejuk di yogyakarta keunggulan lainnya adalah lingkungannya menawarkan panorama yang indah dari bukit ini dapat melihat pemandangan lampu kota atau melihat bintang di malam hari bukit lintang sewu juga punya banyak fasilitas liburan seperti area glamping camping outbound dan hutan kayu putih
68,Grand Puri Waterpark,4.2,Wisata Air,35000,-78.777.662,110.352.078,grand puri waterpark yogya berlokasi di daerah bantul salah satu waterpark terbesar di kabupaten bantul tempat rekreasi keluarga yang menyediakan atraksi dan wahana seru dan bisa dimainkan baik untuk anak anak maupun orang dewasa terdapat kolam seni olympic kolam arus kolam penerima dan kolam batita disana juga terdapat berbagai fasilitas foodcourt freewifi gazebo atm dan masih banyak lagi
69,Balong Waterpark,4.2,Wisata Air,20000,-78.434.924,1.104.103.899,“full of splash and fun” itulah slogan yang diusung oleh balong waterpark di dalam waterpark ini akan kita temukan dua buah kolam utama yang diperuntukkan untuk balita dan orang dewasa selain itu berbagai wahana permainan semacam ember tumbah water coaster hingga family slide juga tersedia untuk dinikmati suasana di dalam lokasi cukup sejuk dan bersih berbagai fasilitas umum juga sudah disiapkan untuk memberi kenyamanan bagi para pengunjung waterpark ini sangat recomended sebagai tujuan rekreasi akhir pekan bersama keluarga anak anak bisa bermain sepuasnya orang dewasa juga bisa bersantai dengan nyamannya
70,Kids Fun Park (Pusat),4.4,Buatan,10000,-7.827.611.573,1.104.413.491,kids fun merupakan wahana atau tempat bermain untuk anak anak
71,Pantai Kesirat,4.6,Pantai,5000,-80.961.535,1.104.350.483,pantai kesirat dapat dijadikan area untuk perkemahan letaknya yang jauh dari keramaian bisa membuat pengunjung jadi lebih nyaman dan menikmati momen kebersamaan ketika berlibur dengan keluarga teman atau kerabat disana fasilitas warung makan dan kamar mandi tetap beroperasi selama jam yang menjadi keunggulan dari pantai kesirat adalah letaknya yang dikelilingi tebing tebing ini merupakan tempat favorit untuk memancing ikan atau sekadar duduk duduk menikmati hembusan angin di pantai
72,Stonehenge Merapi,4.3,Buatan,5000,-76.022.481,1.104.479.012,wisata baru ini baru ngehits di jogja tepatnya di kepuharjo cangkringan sleman kamu bakal menemui replika stonehenge peninggalan jaman prabudaya dan sejarah berupa susunan batu batu besar yang tidak beraturan yang aslinya terletak di inggris bentuk dan susunan batu di stonehenge cangkringan mirip dengan aslinya lengkap dengan alas rumput hijaunya masuk dan duduk di bagian dalam lingkaran tersebut akan jadi pengalaman yang berbeda
73,CitraGrand Mutiara Waterpark Yogyakarta,4.3,Wisata Air,80000,-78.137.343,1.102.831.838,waterpark ini menjadi salah satu objek wisata air favorit untuk keluarga mengusung tema treasure adventure citragrand mutiara waterpark yogya menghadirkan berbagai wahana permainan air yang akan membawa pengunjung seolah berpetualang bersama bajak laut
74,Wisata Telaga Potorono,4.4,Buatan,0,-78.300.074,1.104.204.773,selain diperuntukkan sebagai telaga telaga desa potorono juga dimanfaatkan sebagai tempat wisata alternatif yang menarik telaga desa potorono menawarkan pemandangan yang indah dengan udara yang sejuk di sekitar telaga terdapat enam buah gazebo gubuk yang dapat dimanfaatkan sebagai tempat berteduh
75,Desa Wisata Pulesari,4.4,Desa Wisata,50000,-76.258.806,110.371.698,suasana khas pedesaan akan segera menyambut para wisatawan saat menjejakan kaki pertama kali di desa yang masuk dalam kabupaten sleman ini sungai berair jernih perkebunan salak yang tertata rapi dan sapaan ramah dari warga menjadi pemandangan lumrah di desa ini
76,Wisata Alam Watu Amben,4.4,Alam,0,-78.576.729,1.104.727.388,watu amben jogja merupakan sebuah wisata alam dimana kamu bisa menikmati lampu kota yogyakarta di malam hari salah satu wisata alam unik dari jogja adalah watu amben jogja objek wisata ini tidak hanya memiliki unsur alam namun juga unsur buatan objek wisata ini termasuk ke dalam komplek perbukitan bukit bintang gunung kidul dari atas bukit ini kamu bisa melihat indahnya pemandangan alam dan pemandangan kota jogja apalagi kalau dinikmati pada malam hari kamu bisa melihat kelap kelip lampu kota jogja tempat ini pun menjadi pilihan tempat nongkrong asyk bagi para masyarakat jogja khususnya para anak muda ya karena selain menikmati pemandangan kamu juga bisa menikmati hidangan lezat khas jogja
77,Candi Sojiwan,4.5,Budaya Dan Sejarah,5000,-77.603.952,1.104.962.014,candi sojiwan memiliki keunikan keunikan ini berasal dari beberapa panel relief yang bercerita tentang cerita cerita binatang jika dipahami lebih dalam cerita cerita ini menyampaikan pesan pesan moral yang tidak lekang oleh waktu pesan pesan moral ini juga sangat berguna untuk menjalani kehidupan sehari hari setelah dilakukan penelitian terdapat beberapa temuan menarik salah satunya adalah parit keliling parit keliling ini sebagian berada di pemukiman warga di dalam parit kelagian ditemukan arca pondasi candi struktur pagar batu candi lepas struktur dan batu candi di sekitar permukiman warga yang berada di sebelah selatan candi induk candi sojiwan berada di kawasan siwa plateu yang banyak terdapat candi baik candi berlatar belakang agama hindu maupun budha hal ini menunjukkan bahwa sejak dulu nenek moyang kita telah hidup harmonis dan sangat toleran nilai nilai toleransi ini sangat dibutuhkan masyarakat indonesia sekarang ini mengingat kita berbeda beda keyakinan
78,Goa Selarong,4.3,Alam,6000,-7.860.965.268,1.103.145.237,gua selarong atau bisa disebut gua diponegoro adalah gua berbudaya dan sejarah sekaligus tempat wisata alam dan religius goa selarong merupakan sebuah goa kecil yang berada di dusun kembangputihan kecamatan pajangan bantul lokasinya cukup mudah dijangkau karena tak jauh dari kota bantul diy di goa selarong terdapat dua goa yaitu goa kakung dan goa p sekilas tak ada tampilan yang menarik secara visual dari kedua goa tersebut namun goa itu menyimpan peristiwa besar yang menjadi bagian dari budaya dan sejarah bangsa indonesia terutama kisah kepahlawanan pangeran diponegoro yang menjadi tokoh besar saat meletusnya perang jawa pada utri
79,Waduk Sermo,4.5,Buatan,5000,-7.821.219.329,1.101.149.803,waduk sermo merupakan sebuah waduk yang berada di kabupaten kulon progo daerah istimewa yogyakarta waduk seluas hektar ini dibangun mulai pada tahun dan diresmikan oleh presiden indonesia ke saat itu yaitu presiden soeharto pada november waduk ini dibangun dengan membendung kali ngrancah di desa hargowilis kecamatan kokap adanya pembangunan waduk ini juga mengahruskan pemerintah melakukan program transmigrasi sebanyak kk di transmigrasikan ke tak toi bengkulu ada banyak hal yang bisa sobat semua lakukan di tempat ini yang pertama yaitu berfoto di spot foto menarik terdapat berbagai macam spot foto menarik yang bisa dimanfaatkan pengunjung di tempat ini selanjutnya bagi sobat semua yang hobi memancing ikan tak ada salahnya mencoba memburu ikan “setan merah” yaitu ikan predator yang ada di waduk ini ikan merah merupakan primadona dikalangan pemancing di waduk sermo ini
80,Pantai Glagah,4.4,Pantai,6000,-79.119.427,1.100.647.339,pantai glagah indah adalah salah satu pantai yang menjadi objek wisata di provinsi daerah istimewa yogyakarta pantai glagah indah merupakan salah satu pantai di yogyakarta dengan hamparan pasir yang berwarna hitam dan banyak mengandung pasir besi pantai glagah indah memiliki akses yang baik pantai glagah dikenal sebagai salah satu pantai di jogja yang memiliki ombak cukup besar oleh sebab itu di kawasan pantai pun dibangun tetrapod
81,Grojogan Watu Purbo Bangunrejo,4.5,Alam,5000,-76.340.196,1.103.383.881,tempat ini menjanjikan spot foto selfi yang begitu menarik dan aliran sungai serta taman bunga yang indah pun wisatawan dapat menikmati kuliner pedesaan yang menggugah selera dengan dilatarbelakangi birunya gunung merapi destinasi yang masih terhitung baru ini sebenarnya adalah aliran sungai kali krasak yang berhulu di gunung merapi aliranya terbentuk dari buah sabo dam yang tersusun bertingkat dengan ketinggian sampai meter sehingga tercipta air terjun atau dalam bahasa jawa disebut grojogan
82,Kebun Buah Mangunan,4.5,Agrowisata,6000,-7.939.896,110.424.336,kebun buah mangunan adalah salah satu tempat wisata di kawasan mangunan dlingo kabupaten bantul yogyakarta kawasan wisata yang terkenal sebagai salah satu spot negeri di atas awan ini terletak sekitar kilometer km dari kota yogyakarta dengan waktu tempuh kurang lebih satu jam perjalanan kebun buah mangunan bisa jadi alternatif tempat wisata bersama keluarga di akhir pekan
83,Pantai Ngrenehan,4.4,Pantai,5000,-81.211.475,1.105.142.337,pantai ngrenehan merupakan pantai nelayan terletak di desa kanigoro kecamatan saptosari kurang lebih km di sebelah selatan kota wonosari suatu pantai berupa teluk yang dikelilingi hamparan perbukitan kapur dan memiliki panorama yang sangat memukau dengan deburan ombak menerpa pasir putih pantai ini diapit oleh dua bukit karang yang cukup besar dan menjorok ke laut di pantai ini pengunjung dapat mengamati langsung kegiatan nelayan tradisional juga bisa menikmati ikan segar yang baru saja diangkat dari kedalaman laut selatan
