place_id,name,rating,type,htm,latitude,longitude,description
84,Tirtonirmolo Water Park Galuh,4.2,Wisata Air,30000,-7.748.672,110.501.128,tirtonirmolo water park galuh merupakan gabungan dari hotel galuh yang berada di sisi selatan tirtonirmolo water park galuh wisatawan dapat menikmati berbagai wahana di sekitar tirtonirmolo water park bukan hanya air saja disini juga terdapat kolam yaitu kolam renang dewasa kolam renang seluncur anak anak mandi bola kolam keluarga kolam arus kolam ember tumpah kolam renang songsong gora kolam renang laba laba kuda laut dan kolam air mancur wisata ini cocok didatangi bersama keluarga maupun teman
85,Affandi Museum,4.6,Budaya Dan Sejarah,30000,-7.782.713,110.396.397,museum affandi merupakan salah satu museum seni di daerah istimewa yogyakarta indonesia museum yang berada di tepi sungai gajah wong ini menyimpan berbagai macam lukisan karya affandi selain itu museum ini juga menyimpan banyak benda peninggalan affandi lainnya seperti mobil sepeda onthel dan masih banyak lagi ada lebih dari lukisan termasuk beberapa potret diri dan karya dari seniman terkenal lainnya seperti sudjojono hendra gunawan dan barli jangan lupa untuk mengambil foto rumah affandi yang ikonis dengan atap yang berbentuk pelepah pisang
86,Museum Monumen Pangeran Diponegoro,4.4,Budaya Dan Sejarah,2000,-77.865.891,1.103.514.473,museum monumen pangeran diponegoro adalah museum sekaligus monumen kediaman pangeran ketika dikepung oleh pihak belanda museum ini berisi berbagai peninggalan pangeran diponegoro di museum ini juga terdapat pendapa dan pringgitan yng didalamnya berisi benda benda berbudaya dan sejarah benda berbudaya dan sejarah tersebut berupa berbagai jenis senjata tradisional seperti keris tombak pedang panah dan masih banyak lagi senjata yang dikoleksi di dalam museum ini i museum monument pangeran diponegoro ini juga terdapat dinding yang berlubang yang menjadi jalan keluar pangeran diponegoro untuk bisa lolos dari kepungan penjajah belanda di museum ini juga terdapat barang peninggalan milik sri sultan hamengku buwono ii yaitu ketipung dan wilahan bonang penembung yang terbuat dari kayu dan perunggu yang berwarna merah dan kuning barang peninggalan sri sultan hb ii yang ada mencapai lebih dari buah disana juga terdapat dua senjata meriam yang terletak di depan dan disebelah timur pendopo serta ada berbagai macam peralatan rumah tangga seperti tempat menaruh siri canting teko dan bokor
87,Puncak Kebun Buah Mangunan,4.6,Agrowisata,8000,-79.413.718,1.104.247.345,objek wisata ini menawarkan keindahan berupa panorama alam dataran tinggi yang hijau dan masih sangat alami selain itu dari sana kamu juga bisa menikmati landscape kota bantul dengan segala rutinitas penduduknya landscape yang sangat cantik dan mempesona dari kawasan wisata ini kamu juga bisa menyaksikan gagahnya gunung sewu yang berada di seberang beberapa tanaman yang bisa kamu amati dan pelajari yakni pohon rambutan durian manggis jeruk mangga pohon pinus king grass atau rumput raja salak magium duku sawo cempedak jambu biji dan masih banyak yang lainnya disana wisatawan dapat berburu aneka buah buahan camping melihat watu tumpang yaitu batu besar yang menumpang di atas batu kecil memancing bersepeda berenang belajar pembibitan sapi flying fox
88,Lava Tour Merapi,4.6,Alam,350000,-75.934.503,1.104.316.004,lava tour merapi bisa menjadi pilihan aktivitas wisata ketika berlibur di yogyakarta lava tour merapi adalah istilah untuk tur wisata kawasan terdampak erupsi gunung merapi tahun tur yang dimaksud saat ini merupakan tur menggunakan mobil jenis jeep kegiatan tur meliputi kunjungan ke sejumlah titik yang terkena dampak langsung erupsi ada berbagai macam paket yang disediakan
89,Museum Sonobudoyo Unit I,4.6,Budaya Dan Sejarah,3000,-78.024.499,1.103.639.555,useum sonobudoyo unit pertama yang ada di dekat alun alun keraton yogyakarta yang memiliki bentuk seperti bangunan rumah joglo dengan gaya masjid keraton kasepuhan cirebon di museum ini terdapat koleksi alat musik seperti replika andong wayang rama sinta dan juga lesmana anoman hingga rahwana kemudian koleksi keris koleksi batik dan koleksi buku kebudayaan
90,Museum Factory Dan Kedai Chocolate Monggo,4.6,Agrowisata,15000,-78.408.737,110.298.431,disini wisatawan dapat belajar mengenai budaya dan sejarah cokelat melihat langsung pembuatan cokelat di pabrik dan langsung bisa mempraktekkan membuat cokelat cokelat monggo ini dibuat dari warga negara belgia yang terinspirasi karena rasa rindunya akan rasa cokelat belgia
91,Kawasan Pantai Baron,4.4,Alam,10000,-81.288.246,1.105.487.763,objek wisata pantai baron merupakan pantai yang membentuk cekungan seperti pantai lainnya di pantai baron tersedia aneka ikan laut beserta olahannya ikan yang biasanya dijual di pantai baron adalah udang windu kakap bawal putih dan tongkol pantai baron memiliki fasilitas berupa tempat pelelangan ikan wahana permainan anak anak perahu bermesin dan toko cenderamata buah sirkaya pisang tanduk sirsak dan berbagai macam cenderamata yang terbuat dari kerang laut
92,Kids Fun Galleria Mall,4.4,Buatan,60000,-77.823.797,1.103.791.605,kids fun cabang galeria mall menawarkan tema wild wild west yang membawa kita ke dunia barat dimana kaum koboi dan indian bertemu tidak hanya sekedar nama desain interiornya pun disesuai dengan tema yang diusung di beberapa bagian diletakkan patung koboi dan indian untuk memperkuat suasana belum lagi area counter yang sekilas mirip bar di film film bertema sejenis
93,Taman Bunga Amarilis,4.2,Agrowisata,10000,-78.563.245,1.104.991.167,taman bunga amarlis dapat dikatakan wisata tahunan karena bunga mekar setiap tahun namun jangka mekarnya sangat pendek sehingga pengunjung harus segera datang ketika mekar dan dari tahun ke tahun kondisi taman bunga sudah semakin baik jalan setapak yang sudah rata dengan semen telah disediakan sehingga pengunjung tidak perlu khawatir becek atau kotor karena tanah taman pun telah dibentuk dengan kotak kotak yang membuatnya tampak tertata rapi taman bunga telah dilengkapi dengan jalan setapak yang membantu akses pengunjung lebih dekat dengan bunga jadi angle ketika berfoto lebih terlihat indah taman bunga juga dibentuk sehingga tidak monoton hanya satu lahan seperti sawah
94,Tegaldowo Puspa Gading Park,4.4,Buatan,10000,-78.656.715,1.103.228.654,satu lagi obyek wisata alternatif karya dari warga hadir di kabupaten bantul destinasi baru tersebut telah menjadi viral di media sosial medsos namanya taman puspa gading berlokasi di dusun tegaldowo dukuh grojogan kecamatan bantul bantul diy taman puspa gading berada di pinggiran sungai bedog selain berupa taman untuk berswafoto berlatar belakang hamparan sawah dengan berhiaskan patung kadal raksasa dan jembatan gantung yang membentang di atas sungai taman puspa gading juga memiliki beberapa wahana permainan anak diantaranya kolam renang mandi bola terapi ikan foto dengan badut kelinci motor apv menangkap ikan dan wahana melukis
95,Bendungan Kamijoro,4.3,Buatan,0,-78.787.758,1.102.662.888,bendungan kamijoro adalah bendungan yang menahan aliran sungai progo dan mengalirkan sebagian airnya untuk pengairan areal persawahan tapi bendungan kamijoro bukan sembarang bendungan di atas bendungan ini terbentang jembatan sepanjang meter dengan lebar meter jembatan bendungan kamijoro menghubungkan bantul dan kulon progo tepatnya di dusun plambongan desa triwidadi kecamatan pajangan kabupaten bantul dengan dusun kaliwiru desa tuksono kecamatan sentolo kulon progo tanpa jembatan itu orang harus memutar sangat jauh jembatan ini menjadi landscape baru untuk bantul dan kulon progo bentuknya mirip jembatan ampera di palembang lengkap dengan tiang yang menjulang tinggi dan hiasan tali tali baja yang seolah menyangga beban jembatan bendungan ini jadi salah satu daya tarik wisata sekaligus mampu menggerakkan ekonomi mikro masyarakat di sekitarnya karena banyak yang berkunjung ke sana masyarakat setempat memanfaatkan kesempatan itu untuk berjualan aneka jajanan dan makanan bendungan kamijoro diresmikan langsung oleh presiden joko widodo pada akhir lalu dan hingga kini jadi salah satu magnet wisata di kulon progo dan bantul selain jembatan yang cantik ada juga taman bendungan kamijoro yang bisa jadi pilihan tempat untuk bersantai duduk dan menikmati hembusan angin bendungan yang semilir taman ini berada di sisi barat atau masuk wilayah kulon progo terdapat taman dari sini kita bisa berfoto dengan background jembatan sekaligus bendungan yang megah sedang di sisi timur atau masuk wilayah bantul terdapat sebuah sistem pengairan yang tertata canggih dan modern terdapat beberapa pintu pintu air dengan kontrol elektrik di area taman terdapat plaza yang besar untuk berfoto foto bersantai ataupun berkumpul mengadakan kegiatan massal salah satu spot foto yang jadi favorit pengunjung adalah di bagian undakan tertinggi plaza dengan latar belakang tulisan “bendungan kamijoro ” jika kamu ingin berkunjung ke sini membawa keluarga tak perlu khawatir bendungan kamijoro sangat ramah keluarga tak jauh dari taman terdapat aneka mainan anak anak seperti ayunan jungkat jungkit hingga papan luncur taman juga dikemas sebagai wisata edukasi bagi keluarga dengan ditanam banyak jenis buah buahan seperti durian kelengkeng sawo hingga jambu kristal area taman sudah dibangun untuk pedestrian sehingga sangat nyaman untuk berjalan kaki
96,Goa Kiskendo,4.3,Alam,5000,-77.471.047,1.101.310.147,goa beserta kisah kisah yang menyertainya menjadi daya tarik terbesar obyek wisata ini goa konon sudah ditemukan abad silam para leluhur terdahulu memanfaatkan untuk mencari ketenangan batin dan pencerahan lewat bertapa goa itu sepanjang kilometer goa di dalam bumi bukit menoreh ada dua percabangan besar di dalamnya dan mengarahkan pengunjung pada bekas tempat banyak orang di masa lalu dalam melakoni pertapaan
97,Pantai Ngrumput,4.6,Pantai,10000,-81.403.829,1.105.831.238,pantai ngrumput memang kalah pamor dengan parangtritis namun urusan eksotisme pantai yang terletak di gunung kidul itu tak bisa disepelekan begitu saja karena belum begitu dikenal oleh masyarakat pantai ini seolah belum terjamah sehingga keindahan alamnya masih alami dan juga bersih karena terhindar dari sampah selain itu wisatawan yang datang kemari bisa merasakan memiliki pantai pribadi karena masih sepi pengunjung eksotisme pertama dari pantai ngrumput di mata para wisatawan adalah tepi pantainya seperti halnya pantai gunung kidul lainnya yang terkenal dengan pasir putihnya demikian juga dengan pantai ini istimewanya banyak wisatawan tak ingin beranjak dari pasir tersebut hingga memilih untuk bermalam biasanya kegiatan camping itu selalu identik dengan mendaki gunung kali ini tanpa perlu mendaki wisatawan dapat merasakan sensasi bermalam di bawah sinar rembulan kegiatan ini yang membuat pantai ngrumput ini makin popular di mata wisatawan
98,Pantai Ngedan,4.4,Pantai,5000,-81.163.418,1.104.963.362,pantai ngeden atau ngedan yang terletak di desa krambil sawit tersembunyi di balik bukit karang pantai cantik ini memberikan kesan eksklusif bagi pengunjungnya terletak agak terpencil pantai ngeden menyimpan keindahan alam yang masih terjaga berkunjung kemari memang tidak terlalu mudah karena akses jalannya yang belum maksimal akan tetapi hijaunya perbukitan serta birunya laut akan memanjakan wisatawan begitu tiba di lokasi
99,Pantai Slili,4.5,Pantai,10000,-81.449.664,1.106.028.766,pantai slili merupakan pantai kecil bagian selatan kecamatan tepus kabupaten gunungkidul lokasinya tepat berada di antara pantai krakal dan pantai sadranan ketiganya hanya dipisahkan oleh bukit karang yang bisa dijelajahi salah satu yang populer dari pantai slili adalah posisinya slili diapit oleh dua bukit yang berbatasan langsung dengan pantai yang jauh lebih luas kedua bukit ini membuat area pantai menyerupai teluk berukuran mini pantai slili dikenal memiliki spot spot cantik untuk snorkeling begitu juga dengan pantai slili yang menjadi ‘tetangga’ nya lantai karangnya merupakan habitat yang baik untuk biota laut ada penyewaan alat snorkeling serta jasa instruktur snorkeling yang bisa dicoba jika berkunjung kemari
100,Camera House Borobudur,4.1,Museum,15000,-76.244.995,1.102.027.713,camera house borobudur ini rumah yang dibentuk menyerupai kamera dslr berukuran raksasa rumah kamera ini adalah museum yang menampilkan hasil lukisan pak tanggol dan terdapat studio foto yang unik serta menarik kamu dapat melihat lukisan lukisan yang indah yang terdapat di camera house borobudur ini
101,Candi Kalasan,4.5,Budaya Dan Sejarah,5000,-7.767.284,1.104.723.505,candi kalasan adalah candi yang dipersembahkan untuk dewi tara yang dinding luarnya dilapisi semen kuno candi budha tertua di yogyakarta ini dibangun oleh rakai panangkaran raja dari dinasti syailendra yang juga mengkonsep pendirian borobudur
102,Watu Goyang,4.4,Alam,7000,-79.274.086,1.104.120.586,lantaran lokasi wisata berada di dataran tinggi tak terhalang apa pun membuat wisatawan mudah menikmati keindahan kota jogja dari atas bukit pula terlihat makam makam para raja loh pemandangan alam hijau serta kegagahan gunung merapi terlihat mempesona lanskap seperti itulah sangat cocok mengobati rasa penat maupun bosan setelah sobat dibuat sibuk oleh rutinitas sehari hari
103,Pintoe Langit Dahromo,4.4,Buatan,5000,-7.913.608,110.437.783,pintu langit dahromo ini menyediakan berbagai spot selfie yang hitz dan instagramable dengan latar belakang panorama keindahan sebagian kota jogja yang istimewa adapun berbagai spot foto tersebut seperti spot foto rumah dengan bunga bunga disekitarnya pintu langit gardu pandang yang berbentuk love dan ada juga sayap capung
104,Wana Tirta Mangrove Forests,4.1,Agrowisata,3000,-78.933.459,1.100.198.257,wana tirta mangrove merupakan salah satu tujuan baru terfavorit wisatawan di yogyakarta atau lebih tepatnya di pasirmendit kulon progo awalnya tempat wisata ini dibangun untuk melestarikan alam namun kemudian banyak pengunjung yang menikmati hutan mangrove ini sebagai wisatawan untuk spot foto ada jembatan siapi api atau jembatan bambu ayunan gazebo dan spot lainnya yang di hiasi dengan ornamen bunga selain menikmati pemandangan mangrove pengunjung dapat menikmati tur dengan perahu disekitar area mangrove dan bermain canoe seluruhnya tersedia dengan tambahan biaya dan dilengkapi dengan perlengkapan keamanan
105,Museum Sandi,4.7,Budaya Dan Sejarah,3000,-77.845.549,1.103.711.548,museum sandi adalah museum satu satunya yang menyimpan alat alat untuk mengirim pesan rahasia museum ini juga merekam segala jenis persandian di indonesia bahkan dunia jadi jika anda yang suka memecahkan sandi maka museum ini adalah tempat yang cocok untuk anda kunjungi setiba anda di loby museum sandi akan disambut hangat oleh pengelola museum sandi orang orangnya ramah baik dan legowo banget pada masa itu museum sandi ini adalah museum yang mengoleksi segala jenis benda dan alat untuk memecahkan sandi mulai dari telegraf buku kode sandi sampai mesin mesin sandi yang terbuat di indonesia maupun luar negeri
106,Bukit Teletubbies,4.1,Alam,2000,-78.181.275,110.511.764,wisata satu ini merupakan wisata yang lokasinya berada di pedesaan bukit satu ini tepatnya berada di desa sumberharjo prambanan kabupaten sleman meski berada di pedesaan bukit teletubbies jogja ini juga sama dengan wisata lain yang memiliki ciri khas dan keunikan tersendiri pemandangan yang ditawarkan kawasan perbukitan ini cukup enak dipandang plus kamu juga mendapatkan foto bagus dengan latar belakang perbukitan yang hijau bukit ini diberi nama teletubbies karena adanya gardu panjang yang lokasinya berada di atas gardu ini kebetulan lokasinya berada di di timur rumah domes rumah di dekat gardu ini bentuknya setengah bulat dan mirip rumah di serial teletubbies sehingga rumah itu disebut rumah teletubbies
107,Pantai Watulawang,4.6,Alam,5000,-81.535.837,1.106.177.335,seperti halnya pantai pantai lain di gunung kidul pantai ini banyak terdapat karang dan ombak yang besar namun yang menjadikannya unik terdapat karang yang cukup besar dan bisa digunakan untuk memandang ke arah lautan warga sekitar atau pengelola membuat jembatan yang terbuat dari bambu yang digunakan untuk menyeberang ke karang agar pengunjung dapat menuju ke atas karang dengan aman suasana pantai ini masih tergolong sepi dan banyak terdapat karang karang besar di bibir pantai bisa anda gunakan untuk foto foto dengan teman pacar atau keluarga pasir pantai termasuk luas dengan warna putih kecokelatan khas pasir pantai selatan jogja bersebalahan langsung dengan goa watulawang
108,Ngobaran Beach,4.6,Alam,5000,-81.184.844,1.105.028.785,nama pantai ngobaran yang unik ini tentu tak lepas dari cerita masalalu kisahnya berawal dari kerajaan majapahit dan kerajaan demak sekitar tahun lalu bangunan berupa gapura dan patung patung simbol agama hindu dan budha didirikan tujuannya untuk menghormati kedatangan keturunan raja brawijaya v di pantai tersebut tak hanya gapura prasasti dan beberapa arca saja tapi anda juga akan menemukan bangunan joglo dengan aliran kejawen
109,Candi Banyunibo,4.5,Budaya Dan Sejarah,5000,-77.779.014,1.104.940.734,candi banyunibo adalah candi buddha yang berada tidak jauh dari candi ratu boko yaitu di bagian sebelah timur dari kota yogyakarta ke arah kota wonosari candi ini terdiri atas satu candi induk yang menghadap ke barat dan enam candi perwara yang berbentuk stupa disusun berderet tiga candi perwara di sisi selatan dan tiga candi perwara di sisi timur candi induk lokasinya yang dikelilingi oleh persawahan menjadikan candi banyunibo sebagai salah satu alternatif tempat wisata yang wajib dikunjungi karena selain udara di sekitar candi yang masih alami pengunjung juga bisa mempelajari tentang kekayaan keyakinan manusia indonesia di masa lampau
110,Pantai Nglolang,4.3,Pantai,10000,-81.360.048,110.562.855,pantai ini sangat indah dengan pasir putih dan ombak yang bergulung gulung dan menghempas karang ini masih terbilang sepi dan mengunjungi pantai yang masih sepi ini pastinya obat yang sangat manjur untuk menghilangkan kejenuhan setelah sehari hari berkutat dengan kesibukan deburan ombak yang menggulung gulung dan menghempas karang dan pemandangan cakrawala jauh di depan menjadi obat penetral suasana hati yang ampuh apalagi pemandangan di sekitar pantai ini dipercantik dengan dua tebing yang mengapit pantai
111,Pantai Kuwaru,4.1,Pantai,10000,-7.989.177.883,1.102.265.599,pantai kuwaru terkenal dengan wisata yang terkesan santai dan murah
112,Puncak Suroloyo,4.4,Alam,5000,-7.646.343.961,1.101.810.727,selain cocok untuk menyaksikan keindahan matahari terbenam puncak suroloyo juga terletak di ujung hamparan pegunungan menoreh yang membatasi provinsi jawa tengah dan daerah istimewa yogyakarta tepatnya kabupaten kulon progo dengan magelang berada di puncak suroloyo seolah sedang berada di atap benteng raksasa yang berwarna hijau hal itu wajar karena pegunungan menoreh tampak memanjang bagai benteng yang membatasi kabupaten magelang dengan kulon progo
113,Ramadanu flower garden,4.2,Agrowisata,5000,-76.478.607,1.102.879.467,nama ramadanu tediri dari dua kata yakni rama dan danu rama digunakan karena taman ini dibuka pada bulan ramadan sementara danu dari nama dusun danurojo
114,Goa Jomblang,4.6,Alam,500000,-8.027.954.344,1.106.382.663,goa jomblang merupakan gua vertikal yang bertipe collapse doline gua ini terbentuk akibat proses geologi amblasnya tanah beserta vegetasi yang ada di atasnya ke dasar bumi yang terjadi ribuan tahun lalu runtuhan ini membentuk sinkhole atau sumuran yang dalam bahasa jawa dikenal dengan istilah luweng saat ini gua jomblang merupakan tempat konservasi tumbuhan purba dan dikembangkan menjadi tempat wisata minat khusus yang mana dikelola oleh penduduk atau warga setempat untuk menuruni gua vertikal ini pihak pengelola sudah menyediakan perlengkapan lengkap sesuai standar keselamatan caving di gua vertikal sinar matahari yang menerobos masuk dari luweng grubug setinggi meter membentuk satu tiang cahaya menyinari flowstone yang indah serta kedalaman gua yang gelap gulita air yang menetes dari ketinggian turut mempercantik pemandangan tidak salah jika banyak orang terkagum kagum datang ke sini ketika menyaksikan lukisan alam yang dikenal dengan istilah cahaya surga
115,Candi Abang,4.2,Budaya Dan Sejarah,5000,-78.103.728,110.468.686,candi abang memiliki bentuk seperti piramida dinamakan “candi abang” karena bangunan itu terbuat dari batu bata berwarna merah dari jauh candi ini tampak seperti gundukan tanah atau bukit kecil karena bagian luarnya banyak ditumbuhi rerumputan secara sekilas candi abang tampak hanya seperti gundukan tanah di atas bukit bukit ini bila musim hujan akan berwarna hijau sedangkan pada musim kemarau akan terlihat gersang bangunan candi ini akan terlihat berwarna merah jika kondisinya benar benar kemarau dan kering seperti bangunan candi pada umumnya candi abang dibangun di atas bukit selain itu keunikan lainnya adalah candi ini dibangun dengan batu bata merah hal ini berbeda dengan kebanyakan candi pada umumnya yang dibangun dengan batu andesit
116,Gunung Ireng Srumbung,4.5,Alam,3000,-78.827.926,1.104.896.548,di gunung ireng srumbung teman brisik bisa menemukan spot fajar terbaik tanpa harus mendaki gunung berhari hari dari sini kita juga disuguhkan pemandangan bak negeri di atas awan barisan kabut yang menyelimuti area puncak bukit membuat kita serasa berdiri di atas awan tempat ini sangat fotogenik dan tempat yang nyaman buat refreshing mulai dari spot rumah kecil gazebo sampai gardu pandang membuat teman brisik dengan leluasa memotret momen matahari terbit dari berbagai spot yang telah disediakan
117,Pesona Pengklik Pantai Samas,4,Alam,10000,-8.003.873.302,1.102.703.756,pantai samas merupakan salah satu pantai yang berada di deretan pantai sebelah timur pantai parangtritis lokasi pantai samas kurang lebih km arah selatan kota bantul atau sekitar km dari pusat kota yogyakarta tepatnya di desa srigading kecamatan sanden kabupaten bantul yogyakarta pantai samas terkenal dengan deburan ombaknya yang menggulung angin lautnya yang kencang dan sebagai tempat persinggahan penyu penyu langka seperti penyu sisik dan penyu hijau untuk bertelur selain itu kawasan pantai samas juga memiliki delta delta sungai dan danau air tawar yang membentuk telaga akan tetapi pantai samas memiliki bibir pantai ang agak curam sehingga berbahaya dan tidak disarankan untuk mandi di pantai
118,Pantai Siung,4.6,Alam,10000,-81.818.233,1.106.832.394,pantai siung berlokasi di gunung kidul yogyakarta pantai ini spesial karena lanskapnya yang dikelilingi oleh tebing tebing tinggi karena keunikan itulah pemerintah jogja meresmikan pantai siung sebagai lokasi panjat tebing selama di pantai siung kamu akan melihat banyak batu karang raksasa tersebar di sebelah barat dan timur pantai selain menjadi ciri khas pantai siung keberadaan batu karang ternyata membawa makna bagi asal usul nama pantai ini sebagai rangkuman di pantai ini kalian dapat melakukan aktivitas panjat tebing hammocking berkemah dan jalan jalan di bukit pengilon
119,Goa Seplawan,4.5,Alam,8000,-7.772.978,1.101.102.509,goa yang berada di kawasan pegunungan menoreh ini merupakan goa basah alias terdapat aliran air di dalamnya goa tersebut tepatnya berada di desa donorejo kecamatan kaligesing kabupaten purworejo jawa tengah berbatasan langsung dengan kulonprogo di yogyakarta goa ini memiliki panjang meter dengan cabang cabang goa sekitar – meter dan berdiameter meter sehingga untuk masuk ke dalam goa pengunjung harus menyusuri anak tangga menurun yang cukup melalahkan yang mana rasa lelah itu akan segera hilang begitu mulai memasuki mulut goa sebab dari mulut goa itu saja keindahan ukiran batu di dalam goa sudah terlihat jelas
120,Candi Sari,4.5,Budaya Dan Sejarah,2000,-77.615.576,1.104.742.751,candi sari juga disebut candi bendah adalah candi buddha yang berada tidak jauh dari candi sambi sari candi kalasan dan candi prambanan yaitu di bagian sebelah timur laut dari kota yogyakarta dan tidak begitu jauh dari bandara adisucipto candi ini dibangun pada sekitar abad ke dan ke pada saat zaman kerajaan mataram kuno dengan bentuk yang sangat indah pada bagian atas candi ini terdapat buah stupa seperti yang tampak pada stupa di candi borobudur dan tersusun dalam deretan sejajar bentuk bangunan candi serta ukiran relief yang ada pada dinding candi sangat mirip dengan relief di candi plaosan beberapa ruangan bertingkat dua berada persis di bawah masing masing stupa dan diperkirakan dipakai untuk tempat meditasi bagi para pendeta buddha biksu pada zaman dahulunya candi sari pada masa lampau merupakan suatu vihara buddha dan dipakai sebagai tempat belajar dan berguru bagi para biksu selain untuk wisata budaya dan sejarah pengunjung juga dapat bersepeda bersepeda di candi ini tidak akan memakan banyak waktu dikarenakan candi yang berukuran kecil selain di sekitar candi para pengunjung juga dapat bersepeda menyusuri candi candi lainnya yang lokasinya berdekatan para pengunjung dapat bercengkarama dengan penduduk sekitar candi untuk memperkaya cerita dan budaya dengan dalam dari candi sari ini sendiri
